{"schema_version":"gitguard.candidate/v1alpha2","repo_id":"cross-guard-repo","task_id":"cross-guard-task","worktree_id":"fixture-worktree","requirement_ids":["demo:R"],"allowed_paths":[[46,103,105,116,105,103,110,111,114,101],[67,97,114,103,111,46,108,111,99,107],[67,97,114,103,111,46,116,111,109,108],[97,112,112],[97,112,112,46,112,121],[98,97,115,101,108,105,110,101,46,106,115,111,110],[99,111,114,101],[112,121,112,114,111,106,101,99,116,46,116,111,109,108],[115,112,101,99,115]],"object_format":"sha1","candidate_oid":"10765def2dc06ff914c5e88df9ac5834d607e3ae","base_oid":"88ac090f58453bd5f095bfb844f539ec60ad26a3","merge_group_id":null,"members":[],"source_snapshot_digest":"b7ac69b5f7a37e2bb97ec18bcf119e9fc3e21c5a98c5eb6c87c1836e6a2165fa","policy_digest":"f7922b9067977c89b6e0da60b463a64073e7b91aadadd718615f2dc3b768db23","baseline_digest":null,"advisory":true,"clean":true}